{
  "plugin_id": "core-aiws",
  "version": "0.5.8",
  "public_skills": [
    "aiws-check-skill-library",
    "aiws-improve",
    "aiws-install-drive-skill-library",
    "aiws-propose-skill-update",
    "aiws-refresh-skill-library",
    "aiws-update-skill-library",
    "aiws-validate-skill-library"
  ],
  "public_agents": [],
  "dependencies": [],
  "project_memory_read_scope": [
    "daily_logs",
    "memory_index",
    "topic_files"
  ],
  "project_memory_write_scope": [],
  "shared_memory_read_scope": [
    "global.workflow-patterns",
    "global.prompt-improvement-patterns"
  ],
  "shared_memory_write_scope": [],
  "improve_targets": [
    "protocols/*.md",
    "skills/*/SKILL.md",
    "contracts/*.json",
    "contracts/*.md",
    ".claude-plugin/plugin.json",
    "README.md"
  ]
}
