{
  "plugin_id": "aiws-productivity",
  "version": "0.2.4",
  "public_skills": [
    "meeting-followup"
  ],
  "public_agents": [],
  "dependencies": [
    "core-aiws"
  ],
  "connectors": [
    {
      "id": "slack",
      "kind": "optional-external-plugin",
      "required": false,
      "capabilities": [
        "messages.read",
        "threads.read",
        "search",
        "canvases.read",
        "canvases.write",
        "messages.write",
        "messages.schedule"
      ]
    }
  ],
  "project_memory_read_scope": [],
  "project_memory_write_scope": [],
  "shared_memory_read_scope": [],
  "shared_memory_write_scope": [],
  "improve_targets": [
    "skills/*/SKILL.md",
    "contracts/*.json",
    ".claude-plugin/plugin.json",
    "README.md"
  ]
}
