{
  "plugin_id": "software-engineer-aiws",
  "version": "0.3.3",
  "public_skills": [
    "dev",
    "writing-documentation"
  ],
  "public_agents": [
    "backend-python-engineer",
    "code-debugger",
    "code-tester",
    "code-reviewer",
    "code-simplifier",
    "architecture-simplifier",
    "technical-writer"
  ],
  "dependencies": [
    "core-aiws"
  ],
  "project_memory_read_scope": [],
  "project_memory_write_scope": [],
  "shared_memory_read_scope": [],
  "shared_memory_write_scope": [],
  "improve_targets": [
    "skills/*/SKILL.md",
    "skills/*/references/**/*.md",
    "agents/**/*.md",
    "contracts/*.json",
    ".claude-plugin/plugin.json",
    "README.md"
  ]
}
